{
  "schema_version": "1.1.0",
  "entry_point": "Triage",
  "nodes": [
    { "name": "Triage", "metadata": null },
    {
      "name": "Remediate",
      "metadata": null,
      "kind": "subgraph",
      "graph": {
        "schema_version": "1.0.0",
        "entry_point": "Plan",
        "nodes": [
          { "name": "Plan", "metadata": null },
          { "name": "Apply", "metadata": null },
          { "name": "Abort", "metadata": null }
        ],
        "edges": [
          { "from": "Plan", "to": "Apply", "guarded": false, "condition": null }
        ]
      }
    }
  ],
  "edges": [
    { "from": "Triage", "to": "Remediate", "guarded": false, "condition": null }
  ]
}
