{
  "schema_version": "1.0.0",
  "entry_point": "A",
  "nodes": [
    { "name": "A", "metadata": null },
    { "name": "B", "metadata": null },
    { "name": "C", "metadata": null },
    { "name": "D", "metadata": null }
  ],
  "edges": [
    { "from": "A", "to": "B", "guarded": false, "condition": null },
    { "from": "A", "to": "C", "guarded": false, "condition": null },
    { "from": "B", "to": "D", "guarded": false, "condition": null },
    { "from": "C", "to": "D", "guarded": false, "condition": null },
    { "from": "D", "to": "A", "guarded": true, "condition": "retry" }
  ]
}
