{
  "schema_version": "1.1.0",
  "entry_point": "Triage",
  "nodes": [
    { "name": "Triage", "metadata": null },
    { "name": "Investigate", "metadata": null, "kind": "parallel_group", "branches": [] }
  ],
  "edges": [
    { "from": "Triage", "to": "Investigate", "guarded": false, "condition": null }
  ]
}
